{
  "source_file": "main.c",
  "language": "c",
  "vulnerability_class": "race-condition",
  "findings": [
    {
      "id": "VULN-001",
      "cwe": "CWE-362",
      "owasp": null,
      "title": "Non-atomic balance update in bank transfer",
      "line_start": 21,
      "line_end": 29,
      "complexity_level": "Obvious",
      "detection_difficulty": "Easily_Detectable",
      "description": "Read-yield-write on shared struct fields without mutex protection allows concurrent transfers to corrupt balances"
    },
    {
      "id": "VULN-002",
      "cwe": "CWE-362",
      "owasp": null,
      "title": "TOCTOU in ticket booking",
      "line_start": 42,
      "line_end": 49,
      "complexity_level": "Obvious",
      "detection_difficulty": "Easily_Detectable",
      "description": "Availability check and decrement on global variables are not atomic, allowing overselling of tickets"
    },
    {
      "id": "VULN-003",
      "cwe": "CWE-362",
      "owasp": null,
      "title": "Non-atomic shared counter increment",
      "line_start": 57,
      "line_end": 62,
      "complexity_level": "Obvious",
      "detection_difficulty": "Easily_Detectable",
      "description": "Read-yield-write on global counter causes lost updates under concurrent pthread access"
    },
    {
      "id": "VULN-004",
      "cwe": "CWE-362",
      "owasp": null,
      "title": "TOCTOU in inventory order processing",
      "line_start": 72,
      "line_end": 80,
      "complexity_level": "Moderate",
      "detection_difficulty": "Pattern_Dependent",
      "description": "Stock check and decrement on global variable are not atomic, allowing inventory to go negative"
    },
    {
      "id": "VULN-005",
      "cwe": "CWE-362",
      "owasp": null,
      "title": "Non-atomic restock update",
      "line_start": 82,
      "line_end": 87,
      "complexity_level": "Moderate",
      "detection_difficulty": "Pattern_Dependent",
      "description": "Read-yield-write on inventory_stock races with order processing, causing lost restocks"
    },
    {
      "id": "VULN-006",
      "cwe": "CWE-362",
      "owasp": null,
      "title": "Non-thread-safe singleton config initialization",
      "line_start": 93,
      "line_end": 101,
      "complexity_level": "Nuanced",
      "detection_difficulty": "Likely_Missed",
      "description": "Flag-guarded config initialization without mutex allows multiple allocations, memory leaks, and use of uninitialized data"
    }
  ]
}
