{
  "source_file": "main.c",
  "language": "c",
  "vulnerability_class": "ssrf",
  "findings": [
    {
      "id": "VULN-001",
      "cwe": "CWE-918",
      "owasp": "A10",
      "title": "Direct URL fetch from user input",
      "line_start": 183,
      "line_end": 202,
      "complexity_level": "Obvious",
      "detection_difficulty": "Easily_Detectable",
      "description": "User-supplied URL passed directly to libcurl fetch_remote without any validation"
    },
    {
      "id": "VULN-002",
      "cwe": "CWE-918",
      "owasp": "A10",
      "title": "Incomplete blocklist bypass in URL preview",
      "line_start": 204,
      "line_end": 229,
      "complexity_level": "Moderate",
      "detection_difficulty": "Pattern_Dependent",
      "description": "Preview handler uses strstr to check for localhost and 127.0.0.1 but allows other internal addresses and metadata IPs"
    },
    {
      "id": "VULN-003",
      "cwe": "CWE-918",
      "owasp": "A10",
      "title": "Webhook callback without re-validation",
      "line_start": 257,
      "line_end": 288,
      "complexity_level": "Moderate",
      "detection_difficulty": "Pattern_Dependent",
      "description": "Webhook test handler fetches stored callback URL via libcurl without re-validating the destination"
    },
    {
      "id": "VULN-004",
      "cwe": "CWE-918",
      "owasp": "A10",
      "title": "Metadata endpoint check bypassable via DNS rebinding",
      "line_start": 290,
      "line_end": 318,
      "complexity_level": "Nuanced",
      "detection_difficulty": "Likely_Missed",
      "description": "Import handler uses strstr for 169.254 check on URL string but is bypassable via DNS rebinding or alternative hostnames"
    },
    {
      "id": "VULN-005",
      "cwe": "CWE-918",
      "owasp": "A10",
      "title": "Service proxy with arbitrary base_url fallback",
      "line_start": 320,
      "line_end": 355,
      "complexity_level": "Nuanced",
      "detection_difficulty": "Likely_Missed",
      "description": "Proxy handler falls back to user-supplied base_url when service name is unrecognized, enabling arbitrary SSRF"
    }
  ]
}
