{
  "source_file": "App.java",
  "language": "java",
  "vulnerability_class": "injection/command-injection",
  "findings": [
    {
      "id": "VULN-001",
      "cwe": "CWE-78",
      "owasp": "A03",
      "title": "Command injection via Runtime.exec in ping endpoint",
      "line_start": 29,
      "line_end": 29,
      "complexity_level": "Obvious",
      "detection_difficulty": "Easily_Detectable",
      "description": "User-supplied host parameter concatenated directly into Runtime.exec() shell command without sanitization"
    },
    {
      "id": "VULN-002",
      "cwe": "CWE-78",
      "owasp": "A03",
      "title": "Command injection via shell execution in DNS lookup helper",
      "line_start": 53,
      "line_end": 53,
      "complexity_level": "Moderate",
      "detection_difficulty": "Pattern_Dependent",
      "description": "Domain parameter passed through private helper into Runtime.exec with /bin/sh -c and string concatenation"
    },
    {
      "id": "VULN-003",
      "cwe": "CWE-78",
      "owasp": "A03",
      "title": "Multi-parameter command injection in log search shell pipeline",
      "line_start": 70,
      "line_end": 70,
      "complexity_level": "Nuanced",
      "detection_difficulty": "Likely_Missed",
      "description": "Three user-controlled parameters interpolated into tail|grep shell pipeline via String.format with insufficient quoting"
    },
    {
      "id": "VULN-004",
      "cwe": "CWE-78",
      "owasp": "A03",
      "title": "Command injection via shell execution in archive endpoint",
      "line_start": 109,
      "line_end": 109,
      "complexity_level": "Moderate",
      "detection_difficulty": "Pattern_Dependent",
      "description": "FilePath from request body embedded into tar command via String.format and ProcessBuilder with shell execution"
    },
    {
      "id": "VULN-005",
      "cwe": "CWE-78",
      "owasp": "A03",
      "title": "Command injection via shell execution in port check",
      "line_start": 143,
      "line_end": 143,
      "complexity_level": "Moderate",
      "detection_difficulty": "Easily_Detectable",
      "description": "Host parameter from request body embedded into nc command via String.format and ProcessBuilder with shell execution"
    },
    {
      "id": "VULN-006",
      "cwe": "CWE-78",
      "owasp": "A03",
      "title": "Command injection via complex shell pipeline in certificate check",
      "line_start": 168,
      "line_end": 170,
      "complexity_level": "Nuanced",
      "detection_difficulty": "Likely_Missed",
      "description": "Hostname parameter interpolated three times into complex openssl shell pipeline with redirections"
    }
  ]
}
