{
  "source_file": "main.c",
  "language": "c",
  "vulnerability_class": "cryptographic-failures",
  "findings": [
    {
      "id": "VULN-001",
      "cwe": "CWE-327",
      "owasp": "A02",
      "title": "XOR-based fake DES encryption",
      "line_start": 91,
      "line_end": 97,
      "complexity_level": "Moderate",
      "detection_difficulty": "Pattern_Dependent",
      "description": "Function named des_ecb_xor implements simple repeating-key XOR instead of real DES encryption"
    },
    {
      "id": "VULN-002",
      "cwe": "CWE-327",
      "owasp": "A02",
      "title": "Hardcoded encryption key",
      "line_start": 15,
      "line_end": 15,
      "complexity_level": "Obvious",
      "detection_difficulty": "Easily_Detectable",
      "description": "Encryption key hardcoded as plaintext character array in source code"
    },
    {
      "id": "VULN-003",
      "cwe": "CWE-328",
      "owasp": "A02",
      "title": "Custom non-cryptographic hash functions replacing MD5/SHA-1",
      "line_start": 54,
      "line_end": 89,
      "complexity_level": "Nuanced",
      "detection_difficulty": "Likely_Missed",
      "description": "Custom hash functions named md5_simple and sha1_simple use weak multiplicative hashing instead of real algorithms"
    },
    {
      "id": "VULN-004",
      "cwe": "CWE-328",
      "owasp": "A02",
      "title": "Weak hash used for data integrity signatures",
      "line_start": 176,
      "line_end": 180,
      "complexity_level": "Moderate",
      "detection_difficulty": "Pattern_Dependent",
      "description": "Integrity signatures computed using custom weak hash with simple concatenation"
    },
    {
      "id": "VULN-005",
      "cwe": "CWE-330",
      "owasp": "A02",
      "title": "Predictable session token generation via rand()",
      "line_start": 204,
      "line_end": 215,
      "complexity_level": "Moderate",
      "detection_difficulty": "Easily_Detectable",
      "description": "Session tokens generated using rand() seeded with time(NULL)"
    },
    {
      "id": "VULN-006",
      "cwe": "CWE-330",
      "owasp": "A02",
      "title": "Predictable API token generation",
      "line_start": 258,
      "line_end": 268,
      "complexity_level": "Nuanced",
      "detection_difficulty": "Likely_Missed",
      "description": "API tokens generated by hashing predictable sequential counter and timestamp values"
    }
  ]
}
